{
  "schema_version": 1,
  "bundle": {"id": "masugate.customer-intent.reference", "version": "1.0.0", "layer": "owner", "mode": "configurable"},
  "contracts": {
    "principal_attributes": {},
    "effects": [
      {"action": "api_spend", "argument_types": {"request_ref": "String", "service": "String", "units": "Int"}, "owner": "operational-limits", "required_guarantee": "policy-state-serializable", "consumable_arg": "units", "resolution": {"kind": "provider", "capability": "operational-limits-provider"}},
      {"action": "channel.post", "argument_types": {"broadcast": "Bool", "channel": "String", "content_digest": "String"}, "owner": "communications", "required_guarantee": "policy-state-serializable", "consumable_arg": null, "resolution": {"kind": "provider", "capability": "communications-provider"}},
      {"action": "fs.delete", "argument_types": {"expected_current_digest": "String", "path": "String"}, "owner": "file-workspace", "required_guarantee": "policy-state-serializable", "consumable_arg": null, "resolution": {"kind": "provider", "capability": "workspace-provider"}},
      {"action": "fs.write", "argument_types": {"content": "String", "expected_prior_digest": "String", "path": "String"}, "owner": "file-workspace", "required_guarantee": "policy-state-serializable", "consumable_arg": null, "resolution": {"kind": "provider", "capability": "workspace-provider"}},
      {"action": "http.post", "argument_types": {"content_digest": "String", "destination": "String", "payload_bytes": "Int"}, "owner": "operational-limits", "required_guarantee": "policy-state-serializable", "consumable_arg": "payload_bytes", "resolution": {"kind": "provider", "capability": "operational-limits-provider"}},
      {"action": "send_message", "argument_types": {"channel": "String", "content_digest": "String", "peer": "String"}, "owner": "communications", "required_guarantee": "policy-state-serializable", "consumable_arg": null, "resolution": {"kind": "provider", "capability": "communications-provider"}},
      {"action": "spend.purchase", "argument_types": {"amount_cents": "Int", "merchant_id": "String", "request_ref": "String"}, "owner": "spend", "required_guarantee": "policy-state-serializable", "consumable_arg": "amount_cents", "resolution": {"kind": "provider", "capability": "purchase-provider"}}
    ],
    "views": [
      {"name": "owner.action_permitted", "argument_types": ["String", "String"], "return_type": "Bool", "owner": "customer-intent", "consistency": "owner-configuration-v1", "max_latency_ms": 100, "bounded": true, "reservation_kind": "unsupported", "resolution": {"kind": "provider", "capability": "customer-intent-provider"}},
      {"name": "owner.approval_required", "argument_types": ["String", "String"], "return_type": "Bool", "owner": "customer-intent", "consistency": "owner-configuration-v1", "max_latency_ms": 100, "bounded": true, "reservation_kind": "unsupported", "resolution": {"kind": "provider", "capability": "customer-intent-provider"}},
      {"name": "owner.target_permitted", "argument_types": ["String", "String", "String"], "return_type": "Bool", "owner": "customer-intent", "consistency": "owner-configuration-v1", "max_latency_ms": 100, "bounded": true, "reservation_kind": "unsupported", "resolution": {"kind": "provider", "capability": "customer-intent-provider"}}
    ],
    "certified_inputs": []
  },
  "policies": [
    {"id": "customer_api_spend", "version": "1.0.0", "source": "customer_api_spend.pvl", "semantic_sha256": "aac68b0637fcdb5901dcca7c1ece07fa434cf6459e6ab2f721956822a0d423bc", "action": "api_spend", "required_views": ["owner.action_permitted", "owner.approval_required", "owner.target_permitted"], "certified_inputs": [], "limitations": [{"class": "bounded-reference-api", "statement": "The connector records one durable reference API effect; it does not establish remote service validity or business correctness."}], "governance": {"driver": "customer-intent", "coordination_domain": "masugate.spend.reference.domain.v1", "provider_owner": "operational-limits", "connector_id": "reference-api-runner-v1", "pending_plan": "revalidate", "enforcement": {"kind": "executable"}, "out_of_scope_classes": ["remote-api-validity", "commitment-terms"]}},
    {"id": "customer_channel_post", "version": "1.0.0", "source": "customer_channel_post.pvl", "semantic_sha256": "384938261a7d221dd6fed4afe9cfebb1e194a747470ef125074e0367a8661862", "action": "channel.post", "required_views": ["owner.action_permitted", "owner.approval_required", "owner.target_permitted"], "certified_inputs": [], "limitations": [{"class": "bounded-reference-delivery", "statement": "The connector records one durable reference channel delivery; it does not judge message tone or mediate unregistered channels."}], "governance": {"driver": "customer-intent", "coordination_domain": "masugate.spend.reference.domain.v1", "provider_owner": "communications", "connector_id": "communications-runner-v1", "pending_plan": "revalidate", "enforcement": {"kind": "executable"}, "out_of_scope_classes": ["message-tone", "unmediated-channel"]}},
    {"id": "customer_http_post", "version": "1.0.0", "source": "customer_http_post.pvl", "semantic_sha256": "55238fa96e1f5d41dd39dd23976cf88b26577c6f6726dca1b83f8314be438d8a", "action": "http.post", "required_views": ["owner.action_permitted", "owner.approval_required", "owner.target_permitted"], "certified_inputs": [], "limitations": [{"class": "declared-byte-accounting", "statement": "The reference connector records the exact declared destination, bytes, and content digest; it does not classify arbitrary payload contents."}], "governance": {"driver": "customer-intent", "coordination_domain": "masugate.spend.reference.domain.v1", "provider_owner": "operational-limits", "connector_id": "reference-http-runner-v1", "pending_plan": "revalidate", "enforcement": {"kind": "executable"}, "out_of_scope_classes": ["perfect-pii-classification", "unmediated-egress"]}},
    {"id": "customer_purchase", "version": "1.0.0", "source": "customer_purchase.pvl", "semantic_sha256": "77722bb998b31686286e5b0d08b798726ea4250461d63b6b2a3f0d31ab7579d5", "action": "spend.purchase", "required_views": ["owner.action_permitted", "owner.approval_required", "owner.target_permitted"], "certified_inputs": [], "limitations": [{"class": "task-semantic-correctness", "statement": "Merchant allowlisting and approval surface owner judgment but do not determine a purchase is worthwhile."}], "governance": {"driver": "customer-intent", "coordination_domain": "masugate.spend.reference.domain.v1", "provider_owner": "spend", "connector_id": "reference-purchase-v1", "pending_plan": "revalidate", "enforcement": {"kind": "executable"}, "out_of_scope_classes": ["undisclosed-recurring-terms", "task-semantic-correctness"]}},
    {"id": "customer_send_message", "version": "1.0.0", "source": "customer_send_message.pvl", "semantic_sha256": "02780e1903375bc6cd53dd44f923b2fa5bac23ef36123568abee23cee8daf5fe", "action": "send_message", "required_views": ["owner.action_permitted", "owner.approval_required", "owner.target_permitted"], "certified_inputs": [], "limitations": [{"class": "bounded-reference-delivery", "statement": "The connector records one durable reference peer delivery; it does not judge message tone or mediate unregistered channels."}], "governance": {"driver": "customer-intent", "coordination_domain": "masugate.spend.reference.domain.v1", "provider_owner": "communications", "connector_id": "communications-runner-v1", "pending_plan": "revalidate", "enforcement": {"kind": "executable"}, "out_of_scope_classes": ["message-tone", "unmediated-channel"]}},
    {"id": "customer_workspace_delete", "version": "1.0.0", "source": "customer_workspace_delete.pvl", "semantic_sha256": "5b42d7adaaa3ef85bc8a058624f4b457cede8d7738524d831eeb2852f8d37aad", "action": "fs.delete", "required_views": ["owner.action_permitted", "owner.approval_required", "owner.target_permitted"], "certified_inputs": [], "limitations": [{"class": "bounded-reference-filesystem", "statement": "The connector records one digest-checked logical deletion into connector-owned quarantine; it exposes neither host paths nor file content."}], "governance": {"driver": "customer-intent", "coordination_domain": "masugate.spend.reference.domain.v1", "provider_owner": "file-workspace", "connector_id": "filesystem-v1", "pending_plan": "revalidate", "enforcement": {"kind": "executable"}, "out_of_scope_classes": ["host-path-resolution", "content-correctness"]}},
    {"id": "customer_workspace_write", "version": "1.0.0", "source": "customer_workspace_write.pvl", "semantic_sha256": "5823bd2243c56a5ad1eeab6e746209dd445e16b7486bc73169d15bc03809aa35", "action": "fs.write", "required_views": ["owner.action_permitted", "owner.approval_required", "owner.target_permitted"], "certified_inputs": [], "limitations": [{"class": "bounded-reference-filesystem", "statement": "The connector writes only sealed MasuGate artifact bytes after a digest-checked logical create or replace; it exposes neither host paths nor file content."}], "governance": {"driver": "customer-intent", "coordination_domain": "masugate.spend.reference.domain.v1", "provider_owner": "file-workspace", "connector_id": "filesystem-v1", "pending_plan": "revalidate", "enforcement": {"kind": "executable"}, "out_of_scope_classes": ["host-path-resolution", "content-correctness"]}}
  ]
}
